{
  "id": "mac-brave-stable",
  "version": "1.0.0",
  "engine": "chromium",
  "browser": {
    "name": "brave",
    "channel": "stable",
    "minVersion": "146",
    "maxVersion": "146"
  },
  "os": {
    "name": "macos",
    "version": "26.4.0",
    "arch": "arm64"
  },
  "device": {
    "vendor": "apple",
    "model": "Mac",
    "cpuFamily": "apple-silicon-m4",
    "cores": 14,
    "memoryGB": 16
  },
  "display": {
    "width": 1728,
    "height": 1117,
    "dpr": 2,
    "colorDepth": 30,
    "pixelDepth": 30
  },
  "gpu": {
    "vendor": "Apple",
    "renderer": "ANGLE Metal Renderer: Apple M4 Max",
    "webglUnmaskedVendor": "Google Inc. (Apple)",
    "webglUnmaskedRenderer": "ANGLE (Apple, ANGLE Metal Renderer: Apple M4 Max, Unspecified Version)",
    "webglMaxTextureSize": 16384,
    "webglMaxColorAttachments": 8,
    "webglExtensions": [
      "EXT_clip_control",
      "EXT_color_buffer_float",
      "EXT_color_buffer_half_float",
      "EXT_conservative_depth",
      "EXT_depth_clamp",
      "EXT_disjoint_timer_query_webgl2",
      "EXT_float_blend",
      "EXT_polygon_offset_clamp",
      "EXT_render_snorm",
      "EXT_texture_compression_bptc",
      "EXT_texture_compression_rgtc",
      "EXT_texture_filter_anisotropic",
      "EXT_texture_mirror_clamp_to_edge",
      "EXT_texture_norm16",
      "KHR_parallel_shader_compile",
      "NV_shader_noperspective_interpolation",
      "OES_draw_buffers_indexed",
      "OES_sample_variables",
      "OES_shader_multisample_interpolation",
      "OES_texture_float_linear",
      "WEBGL_blend_func_extended",
      "WEBGL_clip_cull_distance",
      "WEBGL_compressed_texture_astc",
      "WEBGL_compressed_texture_etc",
      "WEBGL_compressed_texture_etc1",
      "WEBGL_compressed_texture_pvrtc",
      "WEBGL_compressed_texture_s3tc",
      "WEBGL_compressed_texture_s3tc_srgb",
      "WEBGL_debug_renderer_info",
      "WEBGL_debug_shaders",
      "WEBGL_lose_context",
      "WEBGL_multi_draw",
      "WEBGL_polygon_mode",
      "WEBGL_provoking_vertex",
      "WEBGL_render_shared_exponent",
      "WEBGL_stencil_texturing"
    ]
  },
  "audio": {
    "contextSampleRate": 48000,
    "audioWorkletLatency": 0.005333333333333333,
    "destinationMaxChannelCount": 2
  },
  "fonts": {
    "family": "macos-system-pack",
    "list": [
      "American Typewriter",
      "Andale Mono",
      "Apple Chancery",
      "Apple Color Emoji",
      "Apple SD Gothic Neo",
      "Arial",
      "Arial Black",
      "Arial Narrow",
      "Avenir",
      "Avenir Next",
      "Baskerville",
      "Big Caslon",
      "Brush Script MT",
      "Chalkboard",
      "Chalkboard SE",
      "Chalkduster",
      "Cochin",
      "Comic Sans MS",
      "Copperplate",
      "Courier",
      "Courier New",
      "Didot",
      "Futura",
      "Geneva",
      "Georgia",
      "Gill Sans",
      "Helvetica",
      "Helvetica Neue",
      "Herculanum",
      "Hiragino Kaku Gothic Pro",
      "Hiragino Mincho Pro",
      "Hiragino Sans",
      "Hoefler Text",
      "Impact",
      "Iowan Old Style",
      "Lucida Grande",
      "Luminari",
      "Marker Felt",
      "Menlo",
      "Microsoft Sans Serif",
      "Monaco",
      "Noteworthy",
      "Optima",
      "PT Sans",
      "Palatino",
      "Papyrus",
      "Phosphate",
      "Rockwell",
      "STIXGeneral",
      "Savoye LET",
      "SignPainter",
      "Skia",
      "Snell Roundhand",
      "Superclarendon",
      "Symbol",
      "System Font",
      "Tahoma",
      "Times New Roman",
      "Trebuchet MS",
      "Verdana",
      "Webdings",
      "Wingdings",
      "Zapfino"
    ]
  },
  "timezone": "Asia/Bangkok",
  "locale": "en-US",
  "languages": [
    "en-US",
    "en"
  ],
  "behavior": {
    "hand": "right",
    "tremor": 0.18,
    "wpm": 60,
    "scrollStyle": "smooth"
  },
  "wreqPreset": "brave_146_macos",
  "userAgent": "Mozilla/5.0 (Macintosh; Intel Mac OS X 10_15_7) AppleWebKit/537.36 (KHTML, like Gecko) Chrome/146.0.0.0 Safari/537.36",
  "uaCh": {
    "sec-ch-ua": "\"Chromium\";v=\"146\", \"Not-A.Brand\";v=\"24\", \"Brave\";v=\"146\"",
    "sec-ch-ua-mobile": "?0",
    "sec-ch-ua-platform": "\"macOS\"",
    "sec-ch-ua-platform-version": "\"26.4.0\"",
    "sec-ch-ua-arch": "\"arm\"",
    "sec-ch-ua-bitness": "\"64\"",
    "sec-ch-ua-model": "\"\"",
    "sec-ch-ua-full-version": "\"146\"",
    "sec-ch-ua-os": "\"macos\""
  },
  "entropyBudget": {
    "fixed": [],
    "perSeed": []
  }
}
